{
  "contract": "ideia.task-run/1",
  "task_id": "tsk_123e4567-e89b-42d3-a456-426614174000",
  "project_id": "prj_123e4567-e89b-42d3-a456-426614174000",
  "workspace_id": "wsp_123e4567-e89b-42d3-a456-426614174000",
  "principal_id": "prn_123e4567-e89b-42d3-a456-426614174000",
  "manifest_id": "mft_123e4567-e89b-42d3-a456-426614174000",
  "manifest_fingerprint": "sha256:0000000000000000000000000000000000000000000000000000000000000000",
  "governance_bundle_id": "default",
  "governance_bundle_fingerprint": "sha256:0000000000000000000000000000000000000000000000000000000000000000",
  "budget_set_id": "bgt_123e4567-e89b-42d3-a456-426614174000",
  "budget_fingerprint": "sha256:0000000000000000000000000000000000000000000000000000000000000000",
  "sandbox_profile_fingerprint": "sha256:0000000000000000000000000000000000000000000000000000000000000000",
  "correlation_id": "cor_123e4567-e89b-42d3-a456-426614174000",
  "created_at": "2024-01-01T00:00:00.000Z"
}
